{"$schema":"https://json-schema.org/draft/2020-12/schema","$id":"https://agentropolis.local/schemas/sovereignty/rights.schema.json","type":"array","items":{"type":"object","additionalProperties":false,"required":["id","license","allowedUse","reviewBy","sourceUri"],"properties":{"id":{"type":"string","pattern":"^[a-z0-9][a-z0-9-]*$"},"license":{"type":"string"},"allowedUse":{"type":"array","items":{"enum":["research","production","restricted-data","evaluation","stress-test"]},"minItems":1,"uniqueItems":true},"reviewBy":{"type":"string","format":"date"},"sourceUri":{"type":"string","format":"uri"}}}}
