[{"id":"open-restricted-ok","license":"Sovereign internal license","allowedUse":["research","production","restricted-data","evaluation","stress-test"],"reviewBy":"2099-12-31","sourceUri":"https://agentropolis.local/rights/open-restricted-ok"},{"id":"evaluation-only","license":"Evaluation only","allowedUse":["research","evaluation"],"reviewBy":"2099-12-31","sourceUri":"https://agentropolis.local/rights/evaluation-only"}]
